tweet_id,sarcasm_label,sarcasm_type,tweet,sarcasm_code,sarcasm_type_code,irony,none,overstatement,rhetorical question,sarcasm,satire,understatement
1159737692810293248,not_sarcastic,none,i have so many books i want to read but not enough time and that makes me v sad,0,1,0,1,0,0,0,0,0
1157998366904791041,sarcastic,sarcasm,Loving the repeats of 'Technical Fault' on every #SkyQ channel this afternoon. Truly gripping television 📺 🙄 @SkyHelpTeam @SkyUK,1,4,0,0,0,0,1,0,0
1135920333737750530,not_sarcastic,none,Could not take my eyes off @JaredHarris during the #chernobyl trial. I have never seen a piece of television so gripping in all my life.,0,1,0,1,0,0,0,0,0
880850684526178304,sarcastic,irony,"3 hour drive back from London, was brilliant, 10 out of 10",1,0,1,0,0,0,0,0,0
875801321017921536,not_sarcastic,none,Real pet peeve is when maxi dresses don't hit the floor.,0,1,0,1,0,0,0,0,0
867480651028672512,not_sarcastic,none,Sometimes there's only so much you can do 🤷🏻‍♀️,0,1,0,1,0,0,0,0,0
861597288858341376,not_sarcastic,none,I'd rather continuously drive around the block than pay for a ticket.,0,1,0,1,0,0,0,0,0
1168274116119580674,not_sarcastic,none,So rude how the weekend just ends,0,1,0,1,0,0,0,0,0
1165279357222424577,not_sarcastic,none,Planning buying a house is too much adulting for me don't even know where to start 😂,0,1,0,1,0,0,0,0,0
1157956888362979328,not_sarcastic,none,Don't think mufasa's death will ever not make me cry 😭💔,0,1,0,1,0,0,0,0,0
1153235083727429632,sarcastic,rhetorical question,Does it have a time machine? RT @PencoedtreHS: 1/2 As you might know we are due to have a new £35 million school (t… https://t.co/8TWBRT125S,1,3,0,0,0,1,0,0,0
1168990443247476738,not_sarcastic,none,I'd slap his arse to kingdom come if he was my child RT @rhodri: Up. Sit up. https://t.co/NVQu1kFNJV,0,1,0,1,0,0,0,0,0
1133128638357016576,not_sarcastic,none,Lord Ramsay Bolton is home 🎉🎉🎉🎉🎉 #bloodycats https://t.co/6JrQxRNDn9,0,1,0,1,0,0,0,0,0
1132375708888645632,not_sarcastic,none,Where the shitting shit is my cat? If you see a white and grey cat with grey ears and a dick on his back in the wes… https://t.co/6m0u7u5jeH,0,1,0,1,0,0,0,0,0
266796311381172224,sarcastic,irony,Hello friday I've been waiting for you all week! Thanks for getting here so quickly and please don't drag coz I need a lie-in 2moz!,1,0,1,0,0,0,0,0,0
331343387317919745,not_sarcastic,none,Can't believe were engaged @Trickster01 love you so much xx,0,1,0,1,0,0,0,0,0
1072962724789915649,sarcastic,rhetorical question,"Hang on, Daniel believes he's invented a soluble powder that cures hangovers. 

Can you 'invent' crushed up Berocca? 

#TheApprentice",1,3,0,0,0,1,0,0,0
1160557863040892928,not_sarcastic,none,Amazing racing in the #WSeries! Could've easily ended in contact but perfect driving all round.,0,1,0,1,0,0,0,0,0
1152147929542643712,not_sarcastic,none,Has a trailer ever been so widely panned  as the Cats one has? Genuinely can't remember a reaction like it. Feels l… https://t.co/atoCxdfKXo,0,1,0,1,0,0,0,0,0
1042981978830602241,not_sarcastic,none,"With @LuckyDayApp, every day is a chance to win real money and prizes by playing FREE games! Use my Lucky Code 'WB6… https://t.co/htlBzBRnpp",0,1,0,1,0,0,0,0,0
1165385271745097728,not_sarcastic,none,"Want to save cash without thinking about it? Check out @hellodigit, it's like magic. https://t.co/Vg594aZEgv",0,1,0,1,0,0,0,0,0
1138448761510879232,not_sarcastic,none,Make the switch to Chime! #chime https://t.co/Xv8HLQNPQv,0,1,0,1,0,0,0,0,0
1076463613030944769,not_sarcastic,none,"For anybody who can't find cheese footballs in South Wales, I've just found some in The Range.  Xmas doesn't have t… https://t.co/jcDstE8Irt",0,1,0,1,0,0,0,0,0
1020344864729456640,not_sarcastic,none,Bloody hell.  Way to rub in my turning 40. https://t.co/NgChK78hdv,0,1,0,1,0,0,0,0,0
1017150800253083648,not_sarcastic,none,Someone should tell Trippier that semi was inappropriate.  #ENGCRO https://t.co/wsefX76Dm6,0,1,0,1,0,0,0,0,0
1172079802502832128,not_sarcastic,none,Confession: I retweet things to remind myself to include them in my future classes. #academiclife https://t.co/jj4XPrx5rH,0,1,0,1,0,0,0,0,0
1171072314802429952,not_sarcastic,none,*Two* Vaughan Williams offerings this afternoon? @ClassicFM spoiling me and making my first day back in the office… https://t.co/7LC5FCshGi,0,1,0,1,0,0,0,0,0
1164590920517541894,sarcastic,sarcasm,Fully embracing my dad bod.,1,4,0,0,0,0,1,0,0
1173464604602773504,not_sarcastic,none,"Game plan was shot from the get go, they were ready for a two tightend set and JJ already admitted to getting a cra… https://t.co/1KZaucj14e",0,1,0,1,0,0,0,0,0
1171118398895546368,not_sarcastic,none,Last day in my twenties 😫,0,1,0,1,0,0,0,0,0
1169098399406284800,not_sarcastic,none,"So, I've listened to a shit ton of music in my day, but I still stand firm with @MSI 's IF album as one of my all time favorites.",0,1,0,1,0,0,0,0,0
1014242156784115712,sarcastic,satire,whomst'd've else likes criticizing socialism using countries with a 70% private economy,1,5,0,0,0,0,0,1,0
962209929292603394,not_sarcastic,none,The way that the democrats are focusing all their attention on Trump specifically makes me think that they might tr… https://t.co/1ecmZ8UDs1,0,1,0,1,0,0,0,0,0
1093263681406861323,not_sarcastic,none,"After seeing the reaction to the old videos of Bernie Sanders, I can't wait for all the cold war shit they're going… https://t.co/5ar1JyRvRS",0,1,0,1,0,0,0,0,0
921521075695038465,not_sarcastic,none,"If the Democrats think that they can slide a neoliberal into the presidency, they will put Trump back into the Whit… https://t.co/z0nozOdrIS",0,1,0,1,0,0,0,0,0
745842214635511808,sarcastic,satire,For some reason my #fitbit goes into sleep mode whenever I chop...because apparently vigorously chopping ginger means I'm sleeping..😴😴🙄,1,5,0,0,0,0,0,1,0
942218073913913344,not_sarcastic,none,"Just saw #thelastjedi... No spoilers, but I do have an overwhelming desire to go home and watch the original series... 😳",0,1,0,1,0,0,0,0,0
884095049134485505,not_sarcastic,none,"8yr old - Are these Disney's beta mugs?
Me - 🤷🏻‍♀️
8yr old - u know..R these their latest version?
Me - I think you need a computer break. 😂",0,1,0,1,0,0,0,0,0
1175522226705227778,not_sarcastic,none,@Jgray_69 @BernieSanders So if it was illegal to accidentally misgender somebody on the street and somebody complai… https://t.co/mSwwXoMkGz,0,1,0,1,0,0,0,0,0
1175526376839008256,not_sarcastic,none,"@Jgray_69 @BernieSanders And in my hypothetical, accidentally misgendering somebody would be illegal in all states.… https://t.co/yOomonyzY8",0,1,0,1,0,0,0,0,0
1093202171674460160,sarcastic,irony,first tweet kinda nervous,1,0,1,0,0,0,0,0,0
1100248910336016384,not_sarcastic,none,my professor said you should spend 2 months’ salary on a wedding ring. so do yourself a favor and wife her up EARLY… https://t.co/UmpyoFLUzk,0,1,0,1,0,0,0,0,0
1107797918180880386,not_sarcastic,none,have you ever eaten something you dropped on the ground cause you were too lazy to go throw it out. because that’s gross i would never,0,1,0,1,0,0,0,0,0
1122015721691676675,not_sarcastic,none,people always leave after the post-credits scene in Marvel films but if you stick around even longer a whole other movie starts playing,0,1,0,1,0,0,0,0,0
1130908474634903556,not_sarcastic,none,my mums asking me to put on tana mongeau to show my dad,0,1,0,1,0,0,0,0,0
1130917724622864385,not_sarcastic,none,my dad loves her too,0,1,0,1,0,0,0,0,0
1133660268205170689,not_sarcastic,none,a year ago today was the worst hangover I’ve ever had and ever will have,0,1,0,1,0,0,0,0,0
890248010566914048,not_sarcastic,none,get tasty food delivered with #deliveroo and get £2.50 off your first order with https://t.co/oF1E70ZeEe          #deliveroocode,0,1,0,1,0,0,0,0,0
852492199585615872,not_sarcastic,none,@SylvanianUK Has to be Freya. It matches her strawberry dress perfectly.,0,1,0,1,0,0,0,0,0
1073305263317377025,not_sarcastic,none,"Came out of the shop near my house and a grey staffie I've never seen before, waiting for her dad, was jumping all… https://t.co/YnBcOZVCrw",0,1,0,1,0,0,0,0,0
1057719193716559872,not_sarcastic,none,Still half a bucket full. Although we missed a few when trick or treating the rain seems to have kept some away. I'… https://t.co/kdiGlW1oXT,0,1,0,1,0,0,0,0,0
1049739473473417216,not_sarcastic,none,"Today our 8 yr old is telling us about his love for the popular ""Twits"" chocolate bar. Guilty of not correcting him… https://t.co/DvWibIRilz",0,1,0,1,0,0,0,0,0
1169707901755318273,sarcastic,irony,Can you believe NO ONE took pictures,1,0,1,0,0,0,0,0,0
1176109758824275968,not_sarcastic,none,Zendaya looks like she’s actually been carved out of gold,0,1,0,1,0,0,0,0,0
1176049657262354432,not_sarcastic,none,Just found out Normani was in Fifth Harmony xxx,0,1,0,1,0,0,0,0,0
1175501808195833856,not_sarcastic,none,Yaaaaas Kelvin and Oti still on top we are HAPPY #scd,0,1,0,1,0,0,0,0,0
1172538601097355269,sarcastic,irony,My plan today is to try to convince as many people as possible that Jason Takes Manhattan is a cinematic masterpiece.,1,0,1,0,0,0,0,0,0
1152338250817781761,not_sarcastic,none,Premiering now! Color Theory in Horror Movies | Film Analysis https://t.co/1oHdnNcJVr via @YouTube,0,1,0,1,0,0,0,0,0
1162379006450327552,not_sarcastic,none,It could be the particular episodes I'm researching but Carol Kane is in a surprising amount of horror movies. Yet… https://t.co/1Q5JVDSxFN,0,1,0,1,0,0,0,0,0
1158522087797121026,not_sarcastic,none,"Con haul from @LSoHDurham,  @ReelSplatter, @VinegarSyndrome
and @HMNPodcast. Did suprisingly  well on made for TV m… https://t.co/Shcg3jqJjT",0,1,0,1,0,0,0,0,0
249095794177753088,sarcastic,sarcasm,@alors_on_parle haah yeah they are really helpful and not lazy at job centres,1,4,0,0,0,0,1,0,0
973965942895140865,not_sarcastic,none,Worst customer service ever experienced from 'Jem' shift manager at Biggleswade Chasing a refund and met with being… https://t.co/9fmlNuTYtm,0,1,0,1,0,0,0,0,0
142509853930299392,not_sarcastic,none,And we are off the bus :),0,1,0,1,0,0,0,0,0
142532009988857856,not_sarcastic,none,Christ its cold.... Need some mittens :),0,1,0,1,0,0,0,0,0
1017128246675214336,sarcastic,sarcasm,Are all the England players top heavy because they seem to be falling over an awful lot? #worldcup https://t.co/j0DuuYTz1C,1,4,0,0,0,0,1,0,0
1165266595414827008,not_sarcastic,none,Don't know why I try and out annoy my boyfriend because I always end up worse off,0,1,0,1,0,0,0,0,0
1153789839222833152,not_sarcastic,none,"""could you open the window, please?"" 

""it already is."" https://t.co/qA9WUPpSv6",0,1,0,1,0,0,0,0,0
1132723965443616768,not_sarcastic,none,Been off work for a week and getting up at 7am tomorrow might honestly kill me https://t.co/WvPEFl9Kmn,0,1,0,1,0,0,0,0,0
966434631338905601,sarcastic,sarcasm,"Well, I know what I’m wearing for the school run tomorrow #dualipa #ritaora",1,4,0,0,0,0,1,0,0
857719660367802368,not_sarcastic,none,Only 6 more weeks of the Tories robotically repeating 'strong and stable' and 'coalition of chaos' at every available opportunity,0,1,0,1,0,0,0,0,0
833410580111302656,not_sarcastic,none,"My little boy's vocab has improved in half-term.. Burnley, quarter final, 'the draw', Wembley, Arsenal or Sutton #essential @LincolnCity_FC",0,1,0,1,0,0,0,0,0
725603220635193344,not_sarcastic,none,A very happy #EdBallsDay,0,1,0,1,0,0,0,0,0
209694449566089216,sarcastic,sarcasm,judging by the Microsoft conference so far it looks like I'll be spending the rest of the year having to talk to my Xbox #e3,1,4,0,0,0,0,1,0,0
208528687690301440,not_sarcastic,none,Anyone got a spare ticket to  @alt_J in Bristol tonight?,0,1,0,1,0,0,0,0,0
140212773018796032,not_sarcastic,none,"Great time seeing @DaveGorman (in Coventry), and has been convinced back onto twitter by the show",0,1,0,1,0,0,0,0,0
182636963961126913,not_sarcastic,none,"amazing gig, death to @loscampesinos rang true #PRAY4JASON",0,1,0,1,0,0,0,0,0
1152300021389225984,sarcastic,irony,now that im stuck back in mp and jobless I just think it’s really rude of my mom to not quit her job so she can kee… https://t.co/hNyYRpb0Lu,1,0,1,0,0,0,0,0,0
1134534924961062912,not_sarcastic,none,here I am worrying about being 10 min late to work and I show up to find out my boss AND my boss’s boss didn’t even show up today so #cool,0,1,0,1,0,0,0,0,0
1133802727551537152,not_sarcastic,none,had toast with butter AND jelly on it this morning thx to @brittttanymoran and it honestly changed my life ~ big th… https://t.co/XsHVyOxmrp,0,1,0,1,0,0,0,0,0
1127000703174565888,not_sarcastic,none,hungover me just wanted a nice calm day at work but noooo there’s currently 7 cop cars chasing down a missing tweak… https://t.co/LoQEPyTnI2,0,1,0,1,0,0,0,0,0
1176231095987253248,not_sarcastic,none,@BBCSounds I want to continue using @BBCiPlayerRadio so please stop telling me to use the #BBCSounds app. It's rubbish in comparison.,0,1,0,1,0,0,0,0,0
1176567297739231233,not_sarcastic,none,man im on some self love shit im finna spend it all on me,0,1,0,1,0,0,0,0,0
1175798414510084098,not_sarcastic,none,ration out the love from the hate,0,1,0,1,0,0,0,0,0
1175119427899154433,not_sarcastic,none,MY LYFT DRIVER JUS DROPPED THE MIRIAM MAKEBA N FUCKED THE CLUB WAYYYY UP,0,1,0,1,0,0,0,0,0
1176540623983108096,not_sarcastic,none,Do we know who wrote this one? Was it Miller? https://t.co/JARKOXRWmX,0,1,0,1,0,0,0,0,0
1176532612761808897,not_sarcastic,none,I think we should impeach. I think we've reached the point where not impeaching says more about us than it does the… https://t.co/WRLYEFonfW,0,1,0,1,0,0,0,0,0
1176525505891225600,not_sarcastic,none,"@Heartless_Lyn Honestly all the fast food companies should do a joint dating sim, where you can date all their masc… https://t.co/NXHw7ZxSfN",0,1,0,1,0,0,0,0,0
1142582472863039493,sarcastic,sarcasm,@parcelforce what day do you people do Saturday delivery? 🚚📦💩 WL0816451,1,4,0,0,0,0,1,0,0
1159887539723018241,not_sarcastic,none,"@Danmumforddraws Bruh, they’re all extra fun!",0,1,0,1,0,0,0,0,0
1136179549396512769,sarcastic,irony,You may think you’re having a good day but I just got a free finger of fudge so who is the real winner… https://t.co/TrwyBWz1YI,1,0,1,0,0,0,0,0,0
1145345772017393664,not_sarcastic,none,"Kylie was the first album I owned, bought for me at Christmas 89 - enjoy yourself. I loved it, and her, ever since… https://t.co/5J6lxQ409R",0,1,0,1,0,0,0,0,0
1145094260200476672,not_sarcastic,none,Not sure the years have been kind to Neil Tennant but what the hell,0,1,0,1,0,0,0,0,0
1170887565391433731,sarcastic,sarcasm,Not to be dramatic but I would die for Josh Gordon.,1,4,0,0,0,0,1,0,0
1098398131543310336,not_sarcastic,none,The Ugly Organ is still one of the greatest records ever.,0,1,0,1,0,0,0,0,0
1056751513094316032,not_sarcastic,none,‘@gx5 and I met on here 5 years ago as we were tweeting about the Red Sox 2013 World Series run. We got married two… https://t.co/Wd2PpD4JPz,0,1,0,1,0,0,0,0,0
639909420131074048,not_sarcastic,none,#refugeeswelcome,0,1,0,1,0,0,0,0,0
606404442636828672,not_sarcastic,none,A really cool concept. https://t.co/UxXMNdQxhn,0,1,0,1,0,0,0,0,0
1025398532180779008,not_sarcastic,none,"#LetsUnlitterUK Litter is disgusting, we have so many areas of natural beauty that are being spoiled by a few selfish morons, clean up",0,1,0,1,0,0,0,0,0
1108685622430949376,not_sarcastic,none,I just took a survey with @populuslive. Great rewards. Great surveys. join here: https://t.co/vKrfQm0fWb,0,1,0,1,0,0,0,0,0
1156827369434439680,not_sarcastic,none,Rishi Sunak in fine form on BBC 1 Breakfast this morning. Excellent communicator. #Brexit #Conservatives,0,1,0,1,0,0,0,0,0
1166485351990517765,not_sarcastic,none,help my boyfriend looks like my teacher,0,1,0,1,0,0,0,0,0
1172348274730242056,sarcastic,sarcasm,Im actually the fastest texter ever,1,4,0,0,0,0,1,0,0
1174192603023192066,not_sarcastic,none,Don't talk to me if u can't keep a convo going,0,1,0,1,0,0,0,0,0
1174899890377220097,not_sarcastic,none,Always keep ya circle small 💯,0,1,0,1,0,0,0,0,0
537361029035225091,not_sarcastic,none,#hiddenvillages Milton Abbas on tv! Drove through when Penelope was filming! &lt;3 home!,0,1,0,1,0,0,0,0,0
737303987498684416,not_sarcastic,none,Go Edd! #quayfest #Weymouth https://t.co/uSTsLTxgrv,0,1,0,1,0,0,0,0,0
945434245895421953,not_sarcastic,none,French and Saunders completes my life ❤❤❤❤❤#frenchandsaunders #300YearsOfFrenchAndSaunders,0,1,0,1,0,0,0,0,0
1162395109310259200,not_sarcastic,none,"@Phoebe_Fuller98 @ScottVhahaney Public schools are a mechanism for entrenching privilege in successive generations,… https://t.co/zYeydAK3mT",0,1,0,1,0,0,0,0,0
1157276404284907520,not_sarcastic,none,@cyclo_furious @allybainton @SSbike @hlved @JohanBruyneel @giroditalia @LeTour So that's income from broadcasting.… https://t.co/rYGJBRiAdl,0,1,0,1,0,0,0,0,0
1075502208047833088,not_sarcastic,none,Check out this Advent Calendar Answer 24 questions and win cool stuff. https://t.co/V2SK1SwKWJ,0,1,0,1,0,0,0,0,0
1073617793025761282,not_sarcastic,none,https://t.co/WfRAz72mco,0,1,0,1,0,0,0,0,0
1071524972340879364,not_sarcastic,none,Check out my Christmas Jumper! https://t.co/Dp3M0dOLyN Design yours with CapitalFM and Save the Children and you co… https://t.co/HvPnm1YBp7,0,1,0,1,0,0,0,0,0
1160111442147860480,sarcastic,sarcasm,@preciouslittle1 I placed an order over 10 days ago on a 7-10 day dispatch and my tracking is still showing that it… https://t.co/IIh3SKfYpl,1,4,0,0,0,0,1,0,0
1047213232157593600,not_sarcastic,none,"Just sitting down to GBBO, a bit late but had to have some homemade profiteroles to enjoy on pastry week 😋 good luc… https://t.co/vucD55MfS7",0,1,0,1,0,0,0,0,0
1144721109440507904,not_sarcastic,none,#imadethis chocolate cake with a very small adaptation on a recipe from June’s @sainsburysmag (used hazelnuts inste… https://t.co/RzhIb5zHcp,0,1,0,1,0,0,0,0,0
1170100485900161025,sarcastic,sarcasm,Oh. Dead rodent in bathroom. Thanks cats.,1,4,0,0,0,0,1,0,0
1171878682236989440,not_sarcastic,none,"I spoke to a lovely doctor today, so lovely it makes me cry just thinking about how nice he was. So glad I got a good one.",0,1,0,1,0,0,0,0,0
1162090993753186306,not_sarcastic,none,I'm supposed to be writing a risk assessment and a method statement for a workshop next week. I am not.,0,1,0,1,0,0,0,0,0
1173719045155295232,not_sarcastic,none,Being racist/homophobic/sexist etc isn’t “edgy comedy” and you’re not “playing devils advocate” you’re just a prick… https://t.co/ow9dLcSwBQ,0,1,0,1,0,0,0,0,0
1171955496456216576,not_sarcastic,none,listening to Daniel Johnston at 2am crying big boy tears,0,1,0,1,0,0,0,0,0
1170771256230240256,not_sarcastic,none,Waterboarding sounds like a lot of fun until you find out what it is,0,1,0,1,0,0,0,0,0
1137294659045249024,sarcastic,sarcasm,The Conservative and Unionist party welcomes you to its live-action medley of 'Lord of the Flies' and 'Atlas Shrugg… https://t.co/vdEvumIC6G,1,4,0,0,0,0,1,0,0
1159453444857577472,not_sarcastic,none,8 years ago Andy Carroll left Newcastle and I pinched one of his rumoured statements as a lyric: 'Make sure they kn… https://t.co/YqOX9f8lwv,0,1,0,1,0,0,0,0,0
1159375514169159680,not_sarcastic,none,#InternationalCatDay from Leon! https://t.co/kBKBd5Au1C,0,1,0,1,0,0,0,0,0
1146538709417889793,not_sarcastic,none,#tfw Stromboli erupts 19 years after your class did a school project on it. I can't remember how I avoided doing it… https://t.co/pY0wHvZz8l,0,1,0,1,0,0,0,0,0
1174779210730278914,not_sarcastic,none,@LaytonWilliams Gentlemen start your engines and may the best woman win!  Cant wait!,0,1,0,1,0,0,0,0,0
1150212546189844480,not_sarcastic,none,@notlarrysabato I think she means let’s solve these problems by having community drug treatment instead of incarceration and the courts.,0,1,0,1,0,0,0,0,0
1134633949743976448,not_sarcastic,none,Alcon rebates from #Novartis and  #Alcon is a total scam. I sent my receipts five times and they were still denied. Never again.,0,1,0,1,0,0,0,0,0
1086063322980597760,not_sarcastic,none,"@mattyglesias Yes, it doesn’t take into account for the different factions having different impacts by state. Like… https://t.co/KUBh650w7o",0,1,0,1,0,0,0,0,0
958534801736241152,sarcastic,satire,"Alrighty then. All immigrants are evil gang members and ""real"" *coughwhitecough* Americans are the only ones whose dreams count. Cool. #SOTU",1,5,0,0,0,0,0,1,0
960338953827176448,not_sarcastic,none,That Dirty Dancing spoof was definitely the best commercial so far. #SuperBowl,0,1,0,1,0,0,0,0,0
901989006027747329,not_sarcastic,none,Oh that was one of the more satisfying deaths on #GameOfThrones,0,1,0,1,0,0,0,0,0
1004826682975371264,sarcastic,irony,Beautiful day,1,0,1,0,0,0,0,0,0
1010877405228085248,not_sarcastic,none,Glad I didn’t have time to put the 2-0 bet I was going to 😂 #ENGvPAN #bbcWorldCup2018,0,1,0,1,0,0,0,0,0
833037420174123012,not_sarcastic,none,Every man and his dog is out tonight. No wonder we couldn't get a table anywhere!,0,1,0,1,0,0,0,0,0
864549064158973952,not_sarcastic,none,Not once been bothered about giving up my season ticket last year...until now. Gutted I won't be there to say goodbye to my absolute hero ☹️,0,1,0,1,0,0,0,0,0
887054107357433858,not_sarcastic,none,Jorah Mormont is like the GoT version of Pablo Zabaleta. My love for him knows no bounds!,0,1,0,1,0,0,0,0,0
463433008008400896,not_sarcastic,none,For all you arrogant Scousers out there who thought you'd get 5 or 6 you should have remembered Villa Park. @SkySportsMNF,0,1,0,1,0,0,0,0,0
900410824468168705,not_sarcastic,none,Arriva not answering perfectly civil questions. Not fit for purpose. https://t.co/uiEfPO5W6m,0,1,0,1,0,0,0,0,0
268315284677472256,not_sarcastic,none,Your family will keep you grounded. God bless and good luck from a Palace fan.@yungzaha,0,1,0,1,0,0,0,0,0
1142353329512767488,not_sarcastic,none,My faith in the viability of Bitcoin as a currency ended when I learned that it doesn't actually work as a currency… https://t.co/V1WrejbmjA,0,1,0,1,0,0,0,0,0
1141734423085404160,not_sarcastic,none,This is a portrait of me and my son that I commissioned from the spectacular @inannaperegrin . Very happy with it! https://t.co/PKxZ096aqK,0,1,0,1,0,0,0,0,0
1141416763260854272,not_sarcastic,none,A monster I drew for #Junicorn - I’m calling it an ‘octocorn’ - an unholy cross between an octopus and a unicorn 🦄 https://t.co/ee9Yhsg7mK,0,1,0,1,0,0,0,0,0
1165409976900358144,sarcastic,sarcasm,@innocent It's green. Definitely green.,1,4,0,0,0,0,1,0,0
1169593040106917889,not_sarcastic,none,@zurisullivan @nycmarathon @RAFranklin_ @RKZwick @florsheim_eb @wilblur @heymsparkerrrrr Happy birthday! 🎂🎂,0,1,0,1,0,0,0,0,0
1168683084381900801,not_sarcastic,none,@watermicrobe Beats the crap out of my wonky carrots. I'm gonna grow some of these bad boys next year!,0,1,0,1,0,0,0,0,0
1158398386481127424,not_sarcastic,none,Does anyone have any experience (in the UK) with making enamel pins? Like where to contact etc. I have a few design… https://t.co/AZSiOKxdVC,0,1,0,1,0,0,0,0,0
1157990373337305088,not_sarcastic,none,I tried to cut a roll yesterday and cut my hand instead. It literally just looks like I’ve scrawled pen across my h… https://t.co/h5Lyn1tXN3,0,1,0,1,0,0,0,0,0
1154416353023074304,not_sarcastic,none,"So, I'm leaving Scotland in less than 12 hours. 😰 Anxious doesn't even cover it.",0,1,0,1,0,0,0,0,0
1174768158168608768,not_sarcastic,none,Life comes at you hard and fast when you least expect it 😟 We got bad news about Mom today and it's sooner than we… https://t.co/ekgXguKQiH,0,1,0,1,0,0,0,0,0
1174078971559870464,not_sarcastic,none,Yes! It's so past time for him to go! https://t.co/gyC9f5xPXg,0,1,0,1,0,0,0,0,0
1170437470569168896,not_sarcastic,none,"#Ohio voters, make sure you're registered to #Vote2020! https://t.co/HDOMdW7Ugv",0,1,0,1,0,0,0,0,0
1025352023422783489,not_sarcastic,none,7 whole years of my life wasted scrolling 😱! #MyTwitterAnniversary https://t.co/u8AaeEOnKk,0,1,0,1,0,0,0,0,0
1051460958307135488,not_sarcastic,none,Hey @JDOfficial why do you put plastic carrier bags INSIDE online orders? I didn’t ask for one and it’s law for bus… https://t.co/XcxtoeLdjQ,0,1,0,1,0,0,0,0,0
1113162166914428930,not_sarcastic,none,Uh oh @HiveHomeUK serious first world problems having to use the actual light switches https://t.co/buexzVMac8,0,1,0,1,0,0,0,0,0
1164552874556297217,not_sarcastic,none,#tellfirstbus bus service in Falkirk is a joke buses never on time and frequently don't turn up at all! 😡,0,1,0,1,0,0,0,0,0
1158463860283756544,sarcastic,sarcasm,Got to love #htafc Twitter 🤣🤣🤣,1,4,0,0,0,0,1,0,0
1157762836547981314,not_sarcastic,none,Up the fucking town #UTT,0,1,0,1,0,0,0,0,0
1153595512442019840,not_sarcastic,none,"Grown men on my timeline across 2 days arguing about who is a ""bigger"" club between Huddersfield and Bournemouth. I… https://t.co/gEY53R7TRq",0,1,0,1,0,0,0,0,0
1151098618281168896,sarcastic,understatement,Can the two imbeciles @BorisJohnson &amp; @Jeremy_Hunt please just stop with all the hardline talk &amp; act like proper ad… https://t.co/6nvi4OeJOE,1,6,0,0,0,0,0,0,1
1151055306366967808,not_sarcastic,none,I love my 3D printer and I love it when it’s dialled in to give a perfect print. Last night I printed this destroye… https://t.co/or5PvuRpiE,0,1,0,1,0,0,0,0,0
1144606867567599616,not_sarcastic,none,My Nan is watching an episode of #CoronationStreet from the early 90’s. Check out the copy of #HeroQuest in the bac… https://t.co/64yVRYhK8p,0,1,0,1,0,0,0,0,0
1129644495035932672,not_sarcastic,none,Its just occurred to me (I’ve been slow on this) that Beauty &amp; the Beast is effectively a Ravenloft love story. A m… https://t.co/aTIVWoFKL8,0,1,0,1,0,0,0,0,0
